Occupation,Description,AgeRange,AttributeTemplate,ProfessionalSkills,BackgroundTemplate,RecommendedTraits,SpecialEquipment,IsDefault,CreatedAt
私家偵探,經驗豐富的調查員，擅長追蹤線索和觀察細節,25-45,"{""STR"":60,""DEX"":65,""INT"":75,""CON"":65,""APP"":55,""EDU"":65,""SIZ"":60,""POW"":70}","{""偵查"":70,""聆聽"":60,""心理學"":50,""圖書館使用"":55,""說服"":50,""法律"":40,""潛行"":45,""開鎖"":30}","在城市的陰暗角落摸爬滾打多年，善於發現他人隱藏的秘密。曾處理過許多奇怪案件，對超自然現象並非完全陌生。","敏銳、謹慎、好奇心重","放大鏡、筆記本、照相機、開鎖工具",True,2023-01-01
醫生,受過專業醫學訓練的治療師，對人體構造和疾病有深入了解,28-50,"{""STR"":55,""DEX"":60,""INT"":80,""CON"":60,""APP"":65,""EDU"":85,""SIZ"":60,""POW"":65}","{""醫學"":75,""急救"":70,""心理學"":55,""生物學"":50,""藥學"":45,""圖書館使用"":50,""信譽"":60,""說服"":45}","在醫學院接受嚴格訓練，見過各種奇怪的病症和死因。科學的思維方式讓你習慣尋找合理解釋，但某些經歷開始讓你懷疑世界並非如表面所見。","冷靜、理性、同情心","醫療包、聽診器、醫學參考書、藥品",True,2023-01-01
學者,大學教授或研究員，博學多聞，專精某個學術領域,30-55,"{""STR"":50,""DEX"":55,""INT"":85,""CON"":55,""APP"":60,""EDU"":90,""SIZ"":55,""POW"":70}","{""圖書館使用"":80,""歷史"":65,""考古學"":60,""人類學"":55,""神秘學"":45,""語言"":60,""教學"":55,""寫作"":50}","在學術象牙塔中度過大半人生，對古老的知識和失落的文明有著濃厚興趣。最近的研究讓你接觸到一些令人不安的資料...","博學、好奇、理論化","大量書籍、筆記、研究資料、放大鏡",True,2023-01-01
記者,新聞工作者，善於挖掘真相和與人交流,22-40,"{""STR"":55,""DEX"":65,""INT"":70,""CON"":60,""APP"":70,""EDU"":70,""SIZ"":60,""POW"":65}","{""快速交談"":70,""說服"":60,""偵查"":65,""聆聽"":55,""心理學"":50,""圖書館使用"":60,""攝影"":45,""寫作"":65}","以揭露真相為職志的新聞工作者，總是在尋找下一個大新聞。你的工作讓你接觸到社會的各個層面，包括一些不為人知的黑暗面。","好奇、執著、社交能力強","照相機、錄音設備、記者證、筆記本",True,2023-01-01
警察,執法人員，具備戰鬥技能和調查經驗,25-45,"{""STR"":70,""DEX"":65,""INT"":60,""CON"":70,""APP"":55,""EDU"":60,""SIZ"":70,""POW"":60}","{""格鬥"":65,""手槍"":70,""偵查"":60,""心理學"":45,""快速交談"":55,""駕駛"":60,""法律"":50,""聆聽"":55}","在街頭維護法律秩序的執法者，見過人性的光明與黑暗。你的職業訓練讓你習慣面對危險，但最近遇到的一些案件讓你開始懷疑世界的真實性。","正義感強、勇敢、謹慎","配槍、警徽、手銬、對講機",True,2023-01-01
軍人,現役或退役軍人，具備優秀的戰鬥和生存技能,20-50,"{""STR"":75,""DEX"":70,""INT"":60,""CON"":80,""APP"":55,""EDU"":55,""SIZ"":70,""POW"":65}","{""格鬥"":70,""手槍"":75,""步槍"":65,""生存"":60,""急救"":55,""領導"":50,""駕駛"":55,""爆破"":40}","經歷過戰場洗禮的軍人，對紀律和榮譽有著堅定信念。你在軍中的某些機密任務讓你接觸到一些不應存在的東西...","紀律嚴明、勇敢、團隊精神","軍用裝備、急救包、戰術刀、通訊設備",True,2023-01-01